{
  "schema_version": "1.0",
  "task_id": "11111111-1111-4111-8111-111111111111",
  "entity_uuid": "019997c0-0000-7000-8000-000000000001",
  "projection_version": 3,
  "receipt_id": "11111111-1111-4111-8111-111111111111",
  "receipt_cluster_time": "1756728001:1",
  "applied_to_current": true,
  "state_changed": true,
  "acknowledged_at": "2026-09-01T12:00:02Z",
  "result_hash": "v1:9f3630a71c70833524455d243af7c1140528f1b5d71141328c35c2f3d0c6166a",
  "event_sha256": "ed1630666fdb08559bc2e013e8a18a0fcfb0b33b8a500030e9956264b44f1f8f"
}
